{
  "confirmation_id": "synthetic-delivery-confirmation-001",
  "related_entity_type": "opportunity",
  "related_entity_id": "synthetic-opportunity-001",
  "status": "confirmed",
  "requested_by_type": "agent",
  "requested_by_id": "synthetic-sales-agent",
  "requested_at": "2026-08-23T11:00:00Z",
  "result": {
    "actor_type": "human",
    "decided_by": "synthetic-factory-user",
    "decided_at": "2026-08-23T12:00:00Z",
    "evidence_ref": "synthetic-capacity-check-001",
    "confirmed_lead_time_days": 30,
    "valid_until": "2026-08-30T12:00:00Z"
  },
  "approval_ref": "synthetic-delivery-approval-001"
}
